{"artifact_id":"artifact:705163c2d401e60115dce5bd457d8e31d77b275ff155205cbefd58a6cf68f7d9","kind":"entry","projection_version":1,"rows":[{"artifact_id":"artifact:705163c2d401e60115dce5bd457d8e31d77b275ff155205cbefd58a6cf68f7d9","node_id":"node:01a1095c2e437b9e9de51d9d951a1e2c","projection_version":1,"row_type":"entry"}]}