{"artifact_id":"artifact:705163c2d401e60115dce5bd457d8e31d77b275ff155205cbefd58a6cf68f7d9","kind":"ending","projection_version":1,"rows":[{"artifact_id":"artifact:705163c2d401e60115dce5bd457d8e31d77b275ff155205cbefd58a6cf68f7d9","class":"unspecified","node_id":"node:01a1095c2e4377c3b19d2d0379951e5b","projection_version":1,"reachable":true,"row_type":"ending"},{"artifact_id":"artifact:705163c2d401e60115dce5bd457d8e31d77b275ff155205cbefd58a6cf68f7d9","class":"unspecified","node_id":"node:01a1095c2e437cc1bdfa2c6bbc6e529b","projection_version":1,"reachable":true,"row_type":"ending"}]}