{"artifact_id":"artifact:705163c2d401e60115dce5bd457d8e31d77b275ff155205cbefd58a6cf68f7d9","kind":"cluster","projection_version":1,"rows":[{"artifact_id":"artifact:705163c2d401e60115dce5bd457d8e31d77b275ff155205cbefd58a6cf68f7d9","cluster_id":"cluster:0d9f12797b321c0284ca972801bd6306","graph":"crossing","package":"road","projection_version":1,"row_type":"cluster","unit_id":null},{"artifact_id":"artifact:705163c2d401e60115dce5bd457d8e31d77b275ff155205cbefd58a6cf68f7d9","cluster_id":"cluster:2b0d4344a2940470bda98c31e0806b23","graph":null,"package":null,"projection_version":1,"row_type":"cluster","unit_id":"0b1d485848e84af4e782fe2ccbb732b23c5373359eda7e72d4ee4af18d1ef787"},{"artifact_id":"artifact:705163c2d401e60115dce5bd457d8e31d77b275ff155205cbefd58a6cf68f7d9","cluster_id":"cluster:684071614467a2a5310d3736320a90e0","graph":null,"package":null,"projection_version":1,"row_type":"cluster","unit_id":"6375b52626f8d724b308d09408621a3f34c7eb222743ffc2bc99394abb2cc4ec"},{"artifact_id":"artifact:705163c2d401e60115dce5bd457d8e31d77b275ff155205cbefd58a6cf68f7d9","cluster_id":"cluster:72687ae74ec9ed33fbbdd74906b8a774","graph":null,"package":null,"projection_version":1,"row_type":"cluster","unit_id":"490076f0e31fddf9540adaddea00bc5d5646d9cbc0e96aec7063c8dbe45d5fd9"},{"artifact_id":"artifact:705163c2d401e60115dce5bd457d8e31d77b275ff155205cbefd58a6cf68f7d9","cluster_id":"cluster:848b982918ded24849bf4842c78a6efb","graph":null,"package":null,"projection_version":1,"row_type":"cluster","unit_id":"e686038ee2cfac694093e752ee986cfa7fb834daca14db244c6af4d9981d394c"},{"artifact_id":"artifact:705163c2d401e60115dce5bd457d8e31d77b275ff155205cbefd58a6cf68f7d9","cluster_id":"cluster:8a3c618d930a5bee09b5a895aa89dd75","graph":null,"package":null,"projection_version":1,"row_type":"cluster","unit_id":"0d4c54c9e7be27d55f5a0b83bd610beee70b459a52eb5a89839539b8ef9f2961"},{"artifact_id":"artifact:705163c2d401e60115dce5bd457d8e31d77b275ff155205cbefd58a6cf68f7d9","cluster_id":"cluster:b3b73703416b24b40995a9329d4fbdaa","graph":null,"package":null,"projection_version":1,"row_type":"cluster","unit_id":"1a15674196a3e4fa69b5c9f7393253f3ff91e62e8b3c6f45e7fc5d160b4bd458"},{"artifact_id":"artifact:705163c2d401e60115dce5bd457d8e31d77b275ff155205cbefd58a6cf68f7d9","cluster_id":"cluster:c385ca38682ec4e9e4054375bed0ae86","graph":null,"package":null,"projection_version":1,"row_type":"cluster","unit_id":"15e48ea598d2c916c3195da53bf19c7419327ee79369c836ef0802026b415c95"},{"artifact_id":"artifact:705163c2d401e60115dce5bd457d8e31d77b275ff155205cbefd58a6cf68f7d9","cluster_id":"cluster:cc8ee7f961b1adc8739abf2971ee6c5b","graph":null,"package":null,"projection_version":1,"row_type":"cluster","unit_id":"b7f122f5f0f8bd31f287452f6ce1257fbd74e68b819c735eb34f44e66cd1622e"},{"artifact_id":"artifact:705163c2d401e60115dce5bd457d8e31d77b275ff155205cbefd58a6cf68f7d9","cluster_id":"cluster:edd0f7da6d4493ae218a33c72109e787","graph":"journey","package":"main","projection_version":1,"row_type":"cluster","unit_id":null},{"artifact_id":"artifact:705163c2d401e60115dce5bd457d8e31d77b275ff155205cbefd58a6cf68f7d9","cluster_id":"cluster:f41f05710d41f3931cc14a4c34aa4f4f","graph":"visit","package":"camp","projection_version":1,"row_type":"cluster","unit_id":null},{"artifact_id":"artifact:705163c2d401e60115dce5bd457d8e31d77b275ff155205cbefd58a6cf68f7d9","cluster_id":"cluster:fc018ddf98a0502fe9b6baba1cf26c1d","graph":null,"package":null,"projection_version":1,"row_type":"cluster","unit_id":"28dcbcc5dc4812379e59e344949f88781ea2ed2279b8547e299661ae0bfdc12b"}]}