{"artifact_id":"artifact:705163c2d401e60115dce5bd457d8e31d77b275ff155205cbefd58a6cf68f7d9","kind":"edge","projection_version":1,"rows":[{"artifact_id":"artifact:705163c2d401e60115dce5bd457d8e31d77b275ff155205cbefd58a6cf68f7d9","choice_point":"choice-point:01a1095c2e437ba59dd48fd4be0bbc61","edge_kind":0,"edge_no":0,"option":"option:01a1095c2e437b698f7e154622c82f1b","projection_version":1,"row_type":"edge","source_node":"node:01a1095c2e437b9e9de51d9d951a1e2c","source_unit":"0b1d485848e84af4e782fe2ccbb732b23c5373359eda7e72d4ee4af18d1ef787","target_node":"node:01a1095c2e43768780152bc61c64951c","target_unit":"0d4c54c9e7be27d55f5a0b83bd610beee70b459a52eb5a89839539b8ef9f2961"},{"artifact_id":"artifact:705163c2d401e60115dce5bd457d8e31d77b275ff155205cbefd58a6cf68f7d9","choice_point":"choice-point:01a1095c2e437ba59dd48fd4be0bbc61","edge_kind":0,"edge_no":1,"option":"option:01a1095ca7f87a59aeee8f82408d92ce","projection_version":1,"row_type":"edge","source_node":"node:01a1095c2e437b9e9de51d9d951a1e2c","source_unit":"0b1d485848e84af4e782fe2ccbb732b23c5373359eda7e72d4ee4af18d1ef787","target_node":"node:01a1095ca7f87b788bdafb59c9031889","target_unit":"15e48ea598d2c916c3195da53bf19c7419327ee79369c836ef0802026b415c95"},{"artifact_id":"artifact:705163c2d401e60115dce5bd457d8e31d77b275ff155205cbefd58a6cf68f7d9","choice_point":"choice-point:01a1095c2e437ba59dd48fd4be0bbc61","edge_kind":0,"edge_no":2,"option":"option:01a1095c2e4375988aec51f5571f73fe","projection_version":1,"row_type":"edge","source_node":"node:01a1095c2e437b9e9de51d9d951a1e2c","source_unit":"0b1d485848e84af4e782fe2ccbb732b23c5373359eda7e72d4ee4af18d1ef787","target_node":"node:01a1095c2e437e0b8af31a3db12e31bc","target_unit":"6375b52626f8d724b308d09408621a3f34c7eb222743ffc2bc99394abb2cc4ec"},{"artifact_id":"artifact:705163c2d401e60115dce5bd457d8e31d77b275ff155205cbefd58a6cf68f7d9","choice_point":"choice-point:01a1095c2e437fc595b9d4c165c4af01","edge_kind":0,"edge_no":3,"option":"option:01a1095c2e437fe0a836b4d701d35f87","projection_version":1,"row_type":"edge","source_node":"node:01a1095c2e43768780152bc61c64951c","source_unit":"0d4c54c9e7be27d55f5a0b83bd610beee70b459a52eb5a89839539b8ef9f2961","target_node":"node:01a1095c2e437b9e9de51d9d951a1e2c","target_unit":"0b1d485848e84af4e782fe2ccbb732b23c5373359eda7e72d4ee4af18d1ef787"},{"artifact_id":"artifact:705163c2d401e60115dce5bd457d8e31d77b275ff155205cbefd58a6cf68f7d9","choice_point":"choice-point:01a1095c2e437fc595b9d4c165c4af01","edge_kind":0,"edge_no":4,"option":"option:01a1095c2e437857b3e9ac28126d1ee3","projection_version":1,"row_type":"edge","source_node":"node:01a1095c2e43768780152bc61c64951c","source_unit":"0d4c54c9e7be27d55f5a0b83bd610beee70b459a52eb5a89839539b8ef9f2961","target_node":"node:01a1095c2e4371e4a87f44627bda7b31","target_unit":"28dcbcc5dc4812379e59e344949f88781ea2ed2279b8547e299661ae0bfdc12b"},{"artifact_id":"artifact:705163c2d401e60115dce5bd457d8e31d77b275ff155205cbefd58a6cf68f7d9","choice_point":"choice-point:01a1095c2e437fc595b9d4c165c4af01","edge_kind":0,"edge_no":5,"option":"option:01a1095c2e43709691c1c1d20b10e418","projection_version":1,"row_type":"edge","source_node":"node:01a1095c2e43768780152bc61c64951c","source_unit":"0d4c54c9e7be27d55f5a0b83bd610beee70b459a52eb5a89839539b8ef9f2961","target_node":"node:01a1095c2e43797a9c29a5f3850c689a","target_unit":"490076f0e31fddf9540adaddea00bc5d5646d9cbc0e96aec7063c8dbe45d5fd9"},{"artifact_id":"artifact:705163c2d401e60115dce5bd457d8e31d77b275ff155205cbefd58a6cf68f7d9","choice_point":null,"edge_kind":1,"edge_no":6,"option":null,"projection_version":1,"row_type":"edge","source_node":"node:01a1095ca7f87b788bdafb59c9031889","source_unit":"15e48ea598d2c916c3195da53bf19c7419327ee79369c836ef0802026b415c95","target_node":"node:01a1095c2e437b9e9de51d9d951a1e2c","target_unit":"0b1d485848e84af4e782fe2ccbb732b23c5373359eda7e72d4ee4af18d1ef787"},{"artifact_id":"artifact:705163c2d401e60115dce5bd457d8e31d77b275ff155205cbefd58a6cf68f7d9","choice_point":"choice-point:01a1095c2e437534b3686842af8acea9","edge_kind":0,"edge_no":7,"option":"option:01a1095c2e437cf08e1cb78d7079c72e","projection_version":1,"row_type":"edge","source_node":"node:01a1095c2e437f11bd35937bb860612d","source_unit":"1a15674196a3e4fa69b5c9f7393253f3ff91e62e8b3c6f45e7fc5d160b4bd458","target_node":"node:01a1095c2e4377c3b19d2d0379951e5b","target_unit":"6f6950bdd3072226144472a30ee26863528dd564166333d91a881b52096d1a13"},{"artifact_id":"artifact:705163c2d401e60115dce5bd457d8e31d77b275ff155205cbefd58a6cf68f7d9","choice_point":"choice-point:01a1095c2e437534b3686842af8acea9","edge_kind":0,"edge_no":8,"option":"option:01a1095c2e437cca8b23d4c1136f5320","projection_version":1,"row_type":"edge","source_node":"node:01a1095c2e437f11bd35937bb860612d","source_unit":"1a15674196a3e4fa69b5c9f7393253f3ff91e62e8b3c6f45e7fc5d160b4bd458","target_node":"node:01a1095c2e437cc1bdfa2c6bbc6e529b","target_unit":"6f6950bdd3072226144472a30ee26863528dd564166333d91a881b52096d1a13"},{"artifact_id":"artifact:705163c2d401e60115dce5bd457d8e31d77b275ff155205cbefd58a6cf68f7d9","choice_point":"choice-point:01a1095c2e437f8eb2c688500318ba37","edge_kind":0,"edge_no":9,"option":"option:01a1095c2e437d08a0c2047ce499b754","projection_version":1,"row_type":"edge","source_node":"node:01a1095c2e4371e4a87f44627bda7b31","source_unit":"28dcbcc5dc4812379e59e344949f88781ea2ed2279b8547e299661ae0bfdc12b","target_node":"node:01a1095c2e437f11bd35937bb860612d","target_unit":"1a15674196a3e4fa69b5c9f7393253f3ff91e62e8b3c6f45e7fc5d160b4bd458"},{"artifact_id":"artifact:705163c2d401e60115dce5bd457d8e31d77b275ff155205cbefd58a6cf68f7d9","choice_point":"choice-point:01a1095c2e437b4289168f4c509d77b4","edge_kind":0,"edge_no":10,"option":"option:01a1095c2e43782881da3c01eba2167b","projection_version":1,"row_type":"edge","source_node":"node:01a1095c2e43797a9c29a5f3850c689a","source_unit":"490076f0e31fddf9540adaddea00bc5d5646d9cbc0e96aec7063c8dbe45d5fd9","target_node":"node:01a1095c2e437f11bd35937bb860612d","target_unit":"1a15674196a3e4fa69b5c9f7393253f3ff91e62e8b3c6f45e7fc5d160b4bd458"},{"artifact_id":"artifact:705163c2d401e60115dce5bd457d8e31d77b275ff155205cbefd58a6cf68f7d9","choice_point":"choice-point:01a1095c2e437906a3ba76615e3fb798","edge_kind":0,"edge_no":11,"option":"option:01a1095c2e437b90a32461379f3ccdda","projection_version":1,"row_type":"edge","source_node":"node:01a1095c2e437e0b8af31a3db12e31bc","source_unit":"6375b52626f8d724b308d09408621a3f34c7eb222743ffc2bc99394abb2cc4ec","target_node":"node:01a1095c2e437b9e9de51d9d951a1e2c","target_unit":"0b1d485848e84af4e782fe2ccbb732b23c5373359eda7e72d4ee4af18d1ef787"},{"artifact_id":"artifact:705163c2d401e60115dce5bd457d8e31d77b275ff155205cbefd58a6cf68f7d9","choice_point":"choice-point:01a1095c2e437906a3ba76615e3fb798","edge_kind":0,"edge_no":12,"option":"option:01a1095c2e437c3db0ff5007061fc7c1","projection_version":1,"row_type":"edge","source_node":"node:01a1095c2e437e0b8af31a3db12e31bc","source_unit":"6375b52626f8d724b308d09408621a3f34c7eb222743ffc2bc99394abb2cc4ec","target_node":"node:01a1095c2e437ef2b3a496c12a47d840","target_unit":"b7f122f5f0f8bd31f287452f6ce1257fbd74e68b819c735eb34f44e66cd1622e"},{"artifact_id":"artifact:705163c2d401e60115dce5bd457d8e31d77b275ff155205cbefd58a6cf68f7d9","choice_point":"choice-point:01a1095c2e437906a3ba76615e3fb798","edge_kind":0,"edge_no":13,"option":"option:01a1095c2e437518aa2500bb3c34f80c","projection_version":1,"row_type":"edge","source_node":"node:01a1095c2e437e0b8af31a3db12e31bc","source_unit":"6375b52626f8d724b308d09408621a3f34c7eb222743ffc2bc99394abb2cc4ec","target_node":"node:01a1095c2e437b029d160d108c77f7ee","target_unit":"e686038ee2cfac694093e752ee986cfa7fb834daca14db244c6af4d9981d394c"},{"artifact_id":"artifact:705163c2d401e60115dce5bd457d8e31d77b275ff155205cbefd58a6cf68f7d9","choice_point":"choice-point:01a1095c2e43715b9ced15ec2498f4cc","edge_kind":0,"edge_no":14,"option":"option:01a1095c2e437892be733513159087c4","projection_version":1,"row_type":"edge","source_node":"node:01a1095c2e437ef2b3a496c12a47d840","source_unit":"b7f122f5f0f8bd31f287452f6ce1257fbd74e68b819c735eb34f44e66cd1622e","target_node":"node:01a1095c2e437e0b8af31a3db12e31bc","target_unit":"6375b52626f8d724b308d09408621a3f34c7eb222743ffc2bc99394abb2cc4ec"},{"artifact_id":"artifact:705163c2d401e60115dce5bd457d8e31d77b275ff155205cbefd58a6cf68f7d9","choice_point":"choice-point:01a1095c2e437452883ff98911ddbf7a","edge_kind":0,"edge_no":15,"option":"option:01a1095c2e43777699cd5d89668ddff7","projection_version":1,"row_type":"edge","source_node":"node:01a1095c2e437b029d160d108c77f7ee","source_unit":"e686038ee2cfac694093e752ee986cfa7fb834daca14db244c6af4d9981d394c","target_node":"node:01a1095c2e437b9e9de51d9d951a1e2c","target_unit":"0b1d485848e84af4e782fe2ccbb732b23c5373359eda7e72d4ee4af18d1ef787"}]}