{"artifact_id":"artifact:705163c2d401e60115dce5bd457d8e31d77b275ff155205cbefd58a6cf68f7d9","kind":"first","projection_version":1,"rows":[{"artifact_id":"artifact:705163c2d401e60115dce5bd457d8e31d77b275ff155205cbefd58a6cf68f7d9","distance":0,"node_id":"node:01a1095c2e437b9e9de51d9d951a1e2c","projection_version":1,"row_type":"first","unit_id":"0b1d485848e84af4e782fe2ccbb732b23c5373359eda7e72d4ee4af18d1ef787"},{"artifact_id":"artifact:705163c2d401e60115dce5bd457d8e31d77b275ff155205cbefd58a6cf68f7d9","distance":2,"node_id":"node:01a1095c2e43768780152bc61c64951c","projection_version":1,"row_type":"first","unit_id":"0d4c54c9e7be27d55f5a0b83bd610beee70b459a52eb5a89839539b8ef9f2961"},{"artifact_id":"artifact:705163c2d401e60115dce5bd457d8e31d77b275ff155205cbefd58a6cf68f7d9","distance":1,"node_id":"node:01a1095ca7f87b788bdafb59c9031889","projection_version":1,"row_type":"first","unit_id":"15e48ea598d2c916c3195da53bf19c7419327ee79369c836ef0802026b415c95"},{"artifact_id":"artifact:705163c2d401e60115dce5bd457d8e31d77b275ff155205cbefd58a6cf68f7d9","distance":5,"node_id":"node:01a1095c2e437f11bd35937bb860612d","projection_version":1,"row_type":"first","unit_id":"1a15674196a3e4fa69b5c9f7393253f3ff91e62e8b3c6f45e7fc5d160b4bd458"},{"artifact_id":"artifact:705163c2d401e60115dce5bd457d8e31d77b275ff155205cbefd58a6cf68f7d9","distance":3,"node_id":"node:01a1095c2e4371e4a87f44627bda7b31","projection_version":1,"row_type":"first","unit_id":"28dcbcc5dc4812379e59e344949f88781ea2ed2279b8547e299661ae0bfdc12b"},{"artifact_id":"artifact:705163c2d401e60115dce5bd457d8e31d77b275ff155205cbefd58a6cf68f7d9","distance":3,"node_id":"node:01a1095c2e43797a9c29a5f3850c689a","projection_version":1,"row_type":"first","unit_id":"490076f0e31fddf9540adaddea00bc5d5646d9cbc0e96aec7063c8dbe45d5fd9"},{"artifact_id":"artifact:705163c2d401e60115dce5bd457d8e31d77b275ff155205cbefd58a6cf68f7d9","distance":3,"node_id":"node:01a1095c2e437e0b8af31a3db12e31bc","projection_version":1,"row_type":"first","unit_id":"6375b52626f8d724b308d09408621a3f34c7eb222743ffc2bc99394abb2cc4ec"},{"artifact_id":"artifact:705163c2d401e60115dce5bd457d8e31d77b275ff155205cbefd58a6cf68f7d9","distance":6,"node_id":"node:01a1095c2e4377c3b19d2d0379951e5b","projection_version":1,"row_type":"first","unit_id":"6f6950bdd3072226144472a30ee26863528dd564166333d91a881b52096d1a13"},{"artifact_id":"artifact:705163c2d401e60115dce5bd457d8e31d77b275ff155205cbefd58a6cf68f7d9","distance":6,"node_id":"node:01a1095c2e437cc1bdfa2c6bbc6e529b","projection_version":1,"row_type":"first","unit_id":"6f6950bdd3072226144472a30ee26863528dd564166333d91a881b52096d1a13"},{"artifact_id":"artifact:705163c2d401e60115dce5bd457d8e31d77b275ff155205cbefd58a6cf68f7d9","distance":4,"node_id":"node:01a1095c2e437ef2b3a496c12a47d840","projection_version":1,"row_type":"first","unit_id":"b7f122f5f0f8bd31f287452f6ce1257fbd74e68b819c735eb34f44e66cd1622e"},{"artifact_id":"artifact:705163c2d401e60115dce5bd457d8e31d77b275ff155205cbefd58a6cf68f7d9","distance":4,"node_id":"node:01a1095c2e437b029d160d108c77f7ee","projection_version":1,"row_type":"first","unit_id":"e686038ee2cfac694093e752ee986cfa7fb834daca14db244c6af4d9981d394c"}]}