{"artifact_id":"artifact:705163c2d401e60115dce5bd457d8e31d77b275ff155205cbefd58a6cf68f7d9","kind":"route","projection_version":1,"rows":[{"artifact_id":"artifact:705163c2d401e60115dce5bd457d8e31d77b275ff155205cbefd58a6cf68f7d9","cluster_id":"cluster:0d9f12797b321c0284ca972801bd6306","ending_node":"node:01a1095c2e4377c3b19d2d0379951e5b","projection_version":1,"row_type":"route"},{"artifact_id":"artifact:705163c2d401e60115dce5bd457d8e31d77b275ff155205cbefd58a6cf68f7d9","cluster_id":"cluster:2b0d4344a2940470bda98c31e0806b23","ending_node":"node:01a1095c2e4377c3b19d2d0379951e5b","projection_version":1,"row_type":"route"},{"artifact_id":"artifact:705163c2d401e60115dce5bd457d8e31d77b275ff155205cbefd58a6cf68f7d9","cluster_id":"cluster:684071614467a2a5310d3736320a90e0","ending_node":"node:01a1095c2e4377c3b19d2d0379951e5b","projection_version":1,"row_type":"route"},{"artifact_id":"artifact:705163c2d401e60115dce5bd457d8e31d77b275ff155205cbefd58a6cf68f7d9","cluster_id":"cluster:72687ae74ec9ed33fbbdd74906b8a774","ending_node":"node:01a1095c2e4377c3b19d2d0379951e5b","projection_version":1,"row_type":"route"},{"artifact_id":"artifact:705163c2d401e60115dce5bd457d8e31d77b275ff155205cbefd58a6cf68f7d9","cluster_id":"cluster:848b982918ded24849bf4842c78a6efb","ending_node":"node:01a1095c2e4377c3b19d2d0379951e5b","projection_version":1,"row_type":"route"},{"artifact_id":"artifact:705163c2d401e60115dce5bd457d8e31d77b275ff155205cbefd58a6cf68f7d9","cluster_id":"cluster:8a3c618d930a5bee09b5a895aa89dd75","ending_node":"node:01a1095c2e4377c3b19d2d0379951e5b","projection_version":1,"row_type":"route"},{"artifact_id":"artifact:705163c2d401e60115dce5bd457d8e31d77b275ff155205cbefd58a6cf68f7d9","cluster_id":"cluster:b3b73703416b24b40995a9329d4fbdaa","ending_node":"node:01a1095c2e4377c3b19d2d0379951e5b","projection_version":1,"row_type":"route"},{"artifact_id":"artifact:705163c2d401e60115dce5bd457d8e31d77b275ff155205cbefd58a6cf68f7d9","cluster_id":"cluster:c385ca38682ec4e9e4054375bed0ae86","ending_node":"node:01a1095c2e4377c3b19d2d0379951e5b","projection_version":1,"row_type":"route"},{"artifact_id":"artifact:705163c2d401e60115dce5bd457d8e31d77b275ff155205cbefd58a6cf68f7d9","cluster_id":"cluster:cc8ee7f961b1adc8739abf2971ee6c5b","ending_node":"node:01a1095c2e4377c3b19d2d0379951e5b","projection_version":1,"row_type":"route"},{"artifact_id":"artifact:705163c2d401e60115dce5bd457d8e31d77b275ff155205cbefd58a6cf68f7d9","cluster_id":"cluster:edd0f7da6d4493ae218a33c72109e787","ending_node":"node:01a1095c2e4377c3b19d2d0379951e5b","projection_version":1,"row_type":"route"},{"artifact_id":"artifact:705163c2d401e60115dce5bd457d8e31d77b275ff155205cbefd58a6cf68f7d9","cluster_id":"cluster:f41f05710d41f3931cc14a4c34aa4f4f","ending_node":"node:01a1095c2e4377c3b19d2d0379951e5b","projection_version":1,"row_type":"route"},{"artifact_id":"artifact:705163c2d401e60115dce5bd457d8e31d77b275ff155205cbefd58a6cf68f7d9","cluster_id":"cluster:fc018ddf98a0502fe9b6baba1cf26c1d","ending_node":"node:01a1095c2e4377c3b19d2d0379951e5b","projection_version":1,"row_type":"route"},{"artifact_id":"artifact:705163c2d401e60115dce5bd457d8e31d77b275ff155205cbefd58a6cf68f7d9","cluster_id":"cluster:0d9f12797b321c0284ca972801bd6306","ending_node":"node:01a1095c2e437cc1bdfa2c6bbc6e529b","projection_version":1,"row_type":"route"},{"artifact_id":"artifact:705163c2d401e60115dce5bd457d8e31d77b275ff155205cbefd58a6cf68f7d9","cluster_id":"cluster:2b0d4344a2940470bda98c31e0806b23","ending_node":"node:01a1095c2e437cc1bdfa2c6bbc6e529b","projection_version":1,"row_type":"route"},{"artifact_id":"artifact:705163c2d401e60115dce5bd457d8e31d77b275ff155205cbefd58a6cf68f7d9","cluster_id":"cluster:684071614467a2a5310d3736320a90e0","ending_node":"node:01a1095c2e437cc1bdfa2c6bbc6e529b","projection_version":1,"row_type":"route"},{"artifact_id":"artifact:705163c2d401e60115dce5bd457d8e31d77b275ff155205cbefd58a6cf68f7d9","cluster_id":"cluster:72687ae74ec9ed33fbbdd74906b8a774","ending_node":"node:01a1095c2e437cc1bdfa2c6bbc6e529b","projection_version":1,"row_type":"route"},{"artifact_id":"artifact:705163c2d401e60115dce5bd457d8e31d77b275ff155205cbefd58a6cf68f7d9","cluster_id":"cluster:848b982918ded24849bf4842c78a6efb","ending_node":"node:01a1095c2e437cc1bdfa2c6bbc6e529b","projection_version":1,"row_type":"route"},{"artifact_id":"artifact:705163c2d401e60115dce5bd457d8e31d77b275ff155205cbefd58a6cf68f7d9","cluster_id":"cluster:8a3c618d930a5bee09b5a895aa89dd75","ending_node":"node:01a1095c2e437cc1bdfa2c6bbc6e529b","projection_version":1,"row_type":"route"},{"artifact_id":"artifact:705163c2d401e60115dce5bd457d8e31d77b275ff155205cbefd58a6cf68f7d9","cluster_id":"cluster:b3b73703416b24b40995a9329d4fbdaa","ending_node":"node:01a1095c2e437cc1bdfa2c6bbc6e529b","projection_version":1,"row_type":"route"},{"artifact_id":"artifact:705163c2d401e60115dce5bd457d8e31d77b275ff155205cbefd58a6cf68f7d9","cluster_id":"cluster:c385ca38682ec4e9e4054375bed0ae86","ending_node":"node:01a1095c2e437cc1bdfa2c6bbc6e529b","projection_version":1,"row_type":"route"},{"artifact_id":"artifact:705163c2d401e60115dce5bd457d8e31d77b275ff155205cbefd58a6cf68f7d9","cluster_id":"cluster:cc8ee7f961b1adc8739abf2971ee6c5b","ending_node":"node:01a1095c2e437cc1bdfa2c6bbc6e529b","projection_version":1,"row_type":"route"},{"artifact_id":"artifact:705163c2d401e60115dce5bd457d8e31d77b275ff155205cbefd58a6cf68f7d9","cluster_id":"cluster:edd0f7da6d4493ae218a33c72109e787","ending_node":"node:01a1095c2e437cc1bdfa2c6bbc6e529b","projection_version":1,"row_type":"route"},{"artifact_id":"artifact:705163c2d401e60115dce5bd457d8e31d77b275ff155205cbefd58a6cf68f7d9","cluster_id":"cluster:f41f05710d41f3931cc14a4c34aa4f4f","ending_node":"node:01a1095c2e437cc1bdfa2c6bbc6e529b","projection_version":1,"row_type":"route"},{"artifact_id":"artifact:705163c2d401e60115dce5bd457d8e31d77b275ff155205cbefd58a6cf68f7d9","cluster_id":"cluster:fc018ddf98a0502fe9b6baba1cf26c1d","ending_node":"node:01a1095c2e437cc1bdfa2c6bbc6e529b","projection_version":1,"row_type":"route"}]}