{"artifact_id":"artifact:705163c2d401e60115dce5bd457d8e31d77b275ff155205cbefd58a6cf68f7d9","kind":"unit","projection_version":1,"rows":[{"artifact_id":"artifact:705163c2d401e60115dce5bd457d8e31d77b275ff155205cbefd58a6cf68f7d9","content_key":"main.station","projection_version":1,"provider":"local","row_type":"unit","unit_id":"0b1d485848e84af4e782fe2ccbb732b23c5373359eda7e72d4ee4af18d1ef787"},{"artifact_id":"artifact:705163c2d401e60115dce5bd457d8e31d77b275ff155205cbefd58a6cf68f7d9","content_key":"road.rocks","projection_version":1,"provider":"local","row_type":"unit","unit_id":"0d4c54c9e7be27d55f5a0b83bd610beee70b459a52eb5a89839539b8ef9f2961"},{"artifact_id":"artifact:705163c2d401e60115dce5bd457d8e31d77b275ff155205cbefd58a6cf68f7d9","content_key":"main.ledger","projection_version":1,"provider":"local","row_type":"unit","unit_id":"15e48ea598d2c916c3195da53bf19c7419327ee79369c836ef0802026b415c95"},{"artifact_id":"artifact:705163c2d401e60115dce5bd457d8e31d77b275ff155205cbefd58a6cf68f7d9","content_key":"main.gate","projection_version":1,"provider":"local","row_type":"unit","unit_id":"1a15674196a3e4fa69b5c9f7393253f3ff91e62e8b3c6f45e7fc5d160b4bd458"},{"artifact_id":"artifact:705163c2d401e60115dce5bd457d8e31d77b275ff155205cbefd58a6cf68f7d9","content_key":"road.trail","projection_version":1,"provider":"local","row_type":"unit","unit_id":"28dcbcc5dc4812379e59e344949f88781ea2ed2279b8547e299661ae0bfdc12b"},{"artifact_id":"artifact:705163c2d401e60115dce5bd457d8e31d77b275ff155205cbefd58a6cf68f7d9","content_key":"road.fog","projection_version":1,"provider":"local","row_type":"unit","unit_id":"490076f0e31fddf9540adaddea00bc5d5646d9cbc0e96aec7063c8dbe45d5fd9"},{"artifact_id":"artifact:705163c2d401e60115dce5bd457d8e31d77b275ff155205cbefd58a6cf68f7d9","content_key":"camp.fire","projection_version":1,"provider":"local","row_type":"unit","unit_id":"6375b52626f8d724b308d09408621a3f34c7eb222743ffc2bc99394abb2cc4ec"},{"artifact_id":"artifact:705163c2d401e60115dce5bd457d8e31d77b275ff155205cbefd58a6cf68f7d9","content_key":"product:ending","projection_version":1,"provider":"local","row_type":"unit","unit_id":"6f6950bdd3072226144472a30ee26863528dd564166333d91a881b52096d1a13"},{"artifact_id":"artifact:705163c2d401e60115dce5bd457d8e31d77b275ff155205cbefd58a6cf68f7d9","content_key":"camp.letter","projection_version":1,"provider":"local","row_type":"unit","unit_id":"b7f122f5f0f8bd31f287452f6ce1257fbd74e68b819c735eb34f44e66cd1622e"},{"artifact_id":"artifact:705163c2d401e60115dce5bd457d8e31d77b275ff155205cbefd58a6cf68f7d9","content_key":"camp.rest","projection_version":1,"provider":"local","row_type":"unit","unit_id":"e686038ee2cfac694093e752ee986cfa7fb834daca14db244c6af4d9981d394c"}]}